{
  "version": 3,
  "source_of_truth": {
    "provider": "github",
    "repository": "diegomoura/open-study-path-agent-test-20260831211026"
  },
  "selected_capabilities": {},
  "resources": [],
  "projection": null,
  "operations": {},
  "resolution": {
    "status": "not_started",
    "unresolved_capabilities": [],
    "validated_at": null
  },
  "sync": {
    "last_attempt_at": null,
    "last_success_at": null,
    "status": "not_started",
    "errors": []
  }
}
